{
  "id": "pattern_feature-grid_editorial_df51a5",
  "source": "httpster",
  "source_url": "https://httpster.net/website/spaces-loversmagazine/",
  "source_title": "Spaces by Lovers Magazine \u2014 Httpster",
  "captured_at": "2026-04-23T14:11:41Z",
  "extracted_at": "2026-04-23T14:24:09Z",
  "region": "feature-grid",
  "bbox": [
    0,
    2293,
    1920,
    676
  ],
  "segment_image": "inspiration/symnera-website/segments/httpster-spaces-by-lovers-magazine-httpster-ca119b25/02-band.png",
  "raw_screenshot": "inspiration/symnera-website/raw/httpster-spaces-by-lovers-magazine-httpster-ca119b25/screenshot.png",
  "pattern_layer": "visual_language",
  "score": 0.765,
  "score_breakdown": {
    "heuristic": 0.743,
    "vision": 0.78,
    "weighted": 0.765
  },
  "features_heuristic": {
    "contrast_ratio": 255.0,
    "edge_density": 0.0578,
    "color_variance": 115.07,
    "whitespace_ratio": 0.001,
    "content_density": 0.999,
    "aspect": 2.84,
    "tension": 0.0416,
    "focal_point": 2.14,
    "palette_top": [
      "#F0F0F0",
      "#000000",
      "#101010",
      "#707070",
      "#808080"
    ],
    "low_signal_flags": []
  },
  "signals": {
    "typography": {
      "scale": "mixed",
      "alignment": "left",
      "density": "normal"
    },
    "composition": {
      "symmetry": "symmetrical",
      "dominant": "mixed",
      "balance": "centered"
    },
    "contrast": "high",
    "rhythm": "structured"
  },
  "insight": "This region effectively combines textual emphasis with visual elements, providing a compelling case for the services offered.",
  "avoid": [
    "glassmorphism",
    "generic saas template",
    "over-rounded friendly UI"
  ],
  "tags": [
    "editorial",
    "dark",
    "grounded",
    "b2b",
    "saas"
  ]
}