{
  "id": "pattern_feature-grid_editorial_2c9c3d",
  "source": "dribbble",
  "source_url": "https://dribbble.com/shots/27264685-Nicole-Minimal-Editorial-Portfolio-Hero",
  "source_title": "Nicole | Minimal Editorial Portfolio Hero by Harsh on Dribbble",
  "captured_at": "2026-04-23T14:09:42Z",
  "extracted_at": "2026-04-23T14:23:36Z",
  "region": "feature-grid",
  "bbox": [
    0,
    1861,
    1920,
    390
  ],
  "segment_image": "inspiration/symnera-website/segments/dribbble-nicole-minimal-editorial-portfolio-hero--7dc515a8/01-band.png",
  "raw_screenshot": "inspiration/symnera-website/raw/dribbble-nicole-minimal-editorial-portfolio-hero--7dc515a8/screenshot.png",
  "pattern_layer": "visual_language",
  "score": 0.719,
  "score_breakdown": {
    "heuristic": 0.673,
    "vision": 0.75,
    "weighted": 0.719
  },
  "features_heuristic": {
    "contrast_ratio": 9.444,
    "edge_density": 0.0336,
    "color_variance": 71.7,
    "whitespace_ratio": 0.004,
    "content_density": 0.996,
    "aspect": 4.923,
    "tension": 0.0305,
    "focal_point": 2.375,
    "palette_top": [
      "#F0F0F0",
      "#101010",
      "#202020",
      "#303030",
      "#705040"
    ],
    "low_signal_flags": []
  },
  "signals": {
    "typography": {
      "scale": "large",
      "alignment": "left",
      "density": "normal"
    },
    "composition": {
      "symmetry": "asymmetrical",
      "dominant": "mixed",
      "balance": "centered"
    },
    "contrast": "high",
    "rhythm": "structured"
  },
  "insight": "The section uses bold typography and a high-contrast palette to emphasize professionalism and modernity, aligning with the brand's industrial SaaS focus.",
  "avoid": [
    "web3 crypto aesthetic",
    "playful illustration heavy"
  ],
  "tags": [
    "editorial",
    "dark",
    "grounded",
    "minimal",
    "industrial",
    "confident"
  ]
}